nama_tempat,rating_tempat,user_ratings_total,latitude,longitude,alamat_tempat,place_id,distance
alfamart,4.8,8,-6.2466634,106.7620832,"jl.ulujami raya no 86 rt 1/4 kel, rw.7, ulujami, kota jakarta selatan",ChIJiZF3MRHxaS4RMkLi-3sXAfI,0
alfamart,3.8,20,-6.241620699999999,106.7563085,"jl. m. saidi no. 37, rt. 004 / 001 kel, rt.7/rw.5, petukangan sel., kota jakarta selatan",ChIJHWXiNejwaS4ROduEiEdqDvs,0
alfamart,4.4,228,-6.2498001,106.7567651,"jl. merpati raya no.1, rt.3/rw.6, pesanggrahan, kota jakarta selatan",ChIJfTNH2u_waS4RfAA7VP4nhgA,0
alfamart ulujami perdatam 2,4.4,278,-6.241565200000001,106.763046,"jl. ulujami raya no.37, rt.11/rw.5, ulujami, kota jakarta selatan",ChIJxVlcmuXxaS4RuKkkG0FzqEg,0
alfamart,4.6,7,-6.2375671,106.7690621,"jl. ciledug raya kel no.99, rw.5, cipulir, kota jakarta selatan",ChIJW9fq8I3xaS4RxMcrn3PVoYk,0
alfamart,4.1,52,-6.2382658,106.7723374,"jl. raya ciledug, rt. 5/4 kel, rt.6/rw.11, cipulir, kota jakarta selatan",ChIJa3p8yiXxaS4RfugjuGiw9us,0
alfamart ulujami perdatam 2,4.4,278,-6.241565200000001,106.763046,"jl. ulujami raya no.37, rt.11/rw.5, ulujami, kota jakarta selatan",ChIJxVlcmuXxaS4RuKkkG0FzqEg,0
