nama_tempat,rating_tempat,user_ratings_total,latitude,longitude,alamat_tempat,place_id,distance
indomaret dr. saharjo,4.2,16,-6.2160036,106.8440714,"jl. dr. saharjo no.109, rt.2/rw.10, manggarai sel., kota jakarta selatan",ChIJk___P4nzaS4R-mx5t36xeEE,932.5517333887465
indomaret tebet,4.7,26,-6.2242003,106.8525338,"jl. kh abdullah syafei no.2, rt.12/rw.5, bukit duri, kota jakarta selatan",ChIJndinnI_zaS4RsBdPM7-_7mo,1297.3008572614208
indomaret menteng wadas,3,2,-6.2106207,106.8419454,"jl. menteng wadas timur no.17, rt.1/rw.7, ps. manggis, kota jakarta selatan",ChIJVxLzin71aS4R5ngDmYA-lEM,1106.4458696588115
indomaret,4.4,75,-6.216285699999999,106.843786,"qrmv+fgp, rt.1/rw.7, menteng atas, south jakarta city",ChIJE27Ce3X0aS4RwPqn75uJU88,974.326286895037
indomaret menteng wadas 2,3.8,8,-6.2113933,106.8415987,"jl. menteng wadas timur no.11, rt.8/rw.1, ps. manggis, kota jakarta selatan",ChIJt6qq6gz0aS4Rc32yPpqE5bc,1131.0307965102352
indomaret abdullah syafei 45c,4.7,6,-6.2258963,106.8575556,"jalan kh. abdullah syafei no.45 1 2, rt.4/rw.1, manggarai sel., kota jakarta selatan",ChIJ63NDeWPzaS4RHVCnhEWtXTU,1615.4110451678728
indomaret guntur t 42,4.4,208,-6.2086144,106.8368663,"jl. guntur no.40, rt.8/rw.1, guntur, kota jakarta selatan",ChIJU8fWq6_1aS4RLiY3lLYzs2o,1704.1212006790076
indomaret tebet raya,4.3,37,-6.230342299999999,106.8514366,"jl. tebet raya no.30 a, rt.2/rw.2, tebet bar., kota jakarta selatan",ChIJV7cl6pDzaS4RnpIsEEg4Wik,1977.7890779154711
indomaret abdulah syafei - kp. melayu,0,0,-6.224908399999999,106.866034,"qvg8+2cv, rt.2/rw.1, bidara cina, east jakarta city",ChIJZ32HrG3zaS4RDEdM-8JgtKs,2091.4999515906493
indomaret al barkah,4.6,18,-6.2204901,106.8472328,"jl. albarkah no.20, rt.7/rw.3, manggarai sel., kota jakarta selatan",ChIJk___P4nzaS4RKHnkXKOuy64,1014.1988460656929
indomaret abdullah syafei,3.6,8,-6.2240566,106.8527215,"jl. abdullah syafe'i no.1 bukit duri, tebet, rt.12/rw.1, south manggarai, south jakarta city",ChIJw3pmkY7zaS4RzEJnuWOCvuI,1282.9037981173008
indomaret menteng atas,3.8,22,-6.214204,106.8409467,"jl. menteng atas no.rt. 03/06, rt.3/rw.6, menteng atas, kota jakarta selatan",ChIJb2LXKQv0aS4RMsA0_7UBZqw,1209.5716336906216
indomaret assirot,0,0,-6.194716499999999,106.8669329,"jl. assirot no. 6a rt. 06/01, sukabumi selatan, kebon jeruk",ChIJ38U6OvX0aS4RDde402dm8fE,2597.7300836537192
indomaret convenience store,4.3,73,-6.2258324,106.858882,"jl. bukit duri tanjakan no. 1 rt 12/ rw 02 rt.3, rt.1/rw.9, bukit duri, kota jakarta selatan",ChIJy6qqaoTzaS4RC_J-x2TbxZU,1672.6606543501493
indomaret minangkabau dalam,4.2,195,-6.215694699999999,106.8422542,"jl. minangkabau dalam no.1, rt.4/rw.14, menteng atas, kota jakarta selatan",ChIJt9agVXX0aS4RMX9VQephLU0,1107.454956600784
indomaret kampung melayu besar,4.2,9,-6.2252467,106.8628154,"jl. kampung melayu besar no.18 rt. 10 / rw. 02, kebon baru, tebet, rt.1/rw.1, kb. baru, kota jakarta selatan",ChIJD391JYPzaS4RQJHI5zLfWfg,1866.3224032871492
indomaret apartemen salemba residence,0,0,-6.1950768,106.8560632,"rv34+xc8, rt.5/rw.8, paseban, central jakarta city",ChIJcSGmzSn1aS4RJUzV3mJzXWw,2001.168877275072
indomaret wisma staco,5,2,-6.2246197,106.8401752,"wisma staco, jl. raya casablanca no.4, rt.4/rw.12, menteng dalam, kota jakarta selatan",ChIJTYdPFlzzaS4R4JoaMHSAiPY,1854.5648822471278
indomaret permata kuningan,3,7,-6.2123971,106.8336757,"jalan kuningan mulia kav. 9c, kel. guntur, kec. setiabudi, rt.6/rw.1, menteng atas, rt.6/rw.1, menteng atas, kota jakarta selatan",ChIJw___Pw70aS4RWR0PfuJ3EbQ,1999.4883768963243
indomaret - manggarai tb98,3.9,17,-6.2093992,106.8477239,"jl. dr. saharjo no.11d, rt.2/rw.5, manggarai, kota jakarta selatan",ChIJC_j2enH0aS4RLYqRmKfTNwU,568.131534279878
indomaret casablanca,3.7,22,-6.2250076,106.8428196,"jalan casablanca, rt. 07 / rw. 11, menteng dalam, tebet, rt.7/rw.11, menteng dalam, kota jakarta selatan",ChIJVaFRO43zaS4R9wZv9oxkGeI,1701.0428367497639
indomaret apartemen casablanca,1,1,-6.2232986,106.8453453,"jl. raya casablanca no.14, rw.5, menteng dalam, kota jakarta selatan",ChIJV4P3VhjzaS4RnuDMhqW9W2w,1389.0544600922638
indomaret,0,0,-6.2299609,106.8664826,"qvc8+2h9, rw.1, kampung melayu, east jakarta city",ChIJZbxsMgvzaS4ROsamm2cDWG0,2528.2206216103687
indomaret asembaris 2. tc71,3.8,10,-6.2292648,106.8590207,"jalan asem baris, rt.5/rw.5, kebon baru, tebet, rt.5/rw.5, kb. baru, kota jakarta selatan",ChIJ95g2h5vzaS4R0qUPfUiXjys,2023.4840864422997
indomaret point stasiun manggarai,3.9,21,-6.2091042,106.8495212,"stasiun kereta api manggarai kebon manggis, rt.15/rw.4, manggarai, kota jakarta selatan",ChIJ4zoAOE7yaS4RTmrqJf3bbYg,457.11489718200295
indomaret pal batu 36,4.3,70,-6.2247397,106.8447512,"jl. pal batu raya no.36, rt.13/rw.4, menteng dalam, kota jakarta selatan",ChIJtX8wqY3zaS4RTpmMPQzAFbg,1560.5691238701659
indomaret basuki rahmat 10,4.8,9,-6.225012299999999,106.8686902,"qvf9+xfw, rt.13/rw.1, bali mester, east jakarta city",ChIJseq4IvvzaS4RkFLeN9IEZOk,2327.8378447804807
indomaret bukit duri tanjakan 106,0,0,-6.224636500000001,106.8590463,"3, jl. ismail no.13-18, rt.3/rw.9, bukit duri, kota jakarta selatan",ChIJ18ZbnBjzaS4RX9R3AMc2iP0,1565.83717180036
indomaret soepomo,4.1,16,-6.2325019,106.8444327,"qr9v+2q4, jalan dr. soepomo, rt.1/rw.3, menteng dalam, kota jakarta selatan",ChIJw4Qe95TzaS4R4TukR0p9hZk,2360.9971271061695
indomaret,4.2,421,-6.229205299999999,106.8474494,"jl. prof supomo no 321 blok bz persil no 19, rt.13/rw.2, tebet barat, rt.13/rw.2, tebet bar., kota jakarta selatan",ChIJxf__P5bzaS4RZ7KfkYohoDc,1911.4601695871138
indomaret gudang peluru,4.8,13,-6.2255444,106.8622325,"jl. gudang peluru raya no.b1, rt.1/rw.1, kebon baru, south jakarta city",ChIJM_MGcAHzaS4RaWCJ-tf_NBA,1850.5050119557498
indomaret plus,0,0,-6.208247399999999,106.8327765,"qrrm+p42, rt.8/rw.2, guntur, south jakarta city",ChIJZU13Dof1aS4RXIGm2TLCTWY,2152.8668079956883
