nama_tempat,rating_tempat,user_ratings_total,latitude,longitude,alamat_tempat,place_id,distance
indomaret,4,3,-6.2511809,106.7781617,"jl. pahlawan no.2, rw.10, kby. lama utara, kota jakarta selatan",ChIJI231igTxaS4RKIR6Aki7DBw,1815.0111673824101
indomaret ciputat raya ta3p,4.3,59,-6.2585712,106.7773998,"jl. ciputat raya no.35, rw.10, kby. lama sel., kota jakarta selatan",ChIJd734LwfxaS4R9GSRMspZ-XE,1850.236187181931
indomaret,4,1,-6.2444003,106.7725752,"jl. peninggaran raya no.9, rw.11, kby. lama utara, kota jakarta selatan",ChIJSY442R3xaS4RiKFQ5S2VbxE,1496.133245413247
indomaret rawa papan,4.1,87,-6.2683369,106.7576132,"jl. rw. papan no.11, rt.5/rw.6, bintaro, kota jakarta selatan",ChIJjV_Ni1rwaS4RQfj-56QgK9w,1816.3019382323441
indomaret bintaro graha,4.3,18,-6.2573003,106.7640903,"jl. bintaro permai, rt.2/rw.9, bintaro, kota jakarta selatan",ChIJt____1DwaS4RKkfX8UBEtdo,586.7001066937966
indomaret ciputat raya 1 {ttdq},4.6,7,-6.269582199999999,106.7748789,"jl. ciputat raya no.1 3 11, rt.3/rw.11, pd. pinang, kota jakarta selatan",ChIJY-C-8sPxaS4RnTlXQJ-0AgA,2383.468901623614
indomaret kesehatan bintar,5,2,-6.267895800000001,106.7617975,"jl. kesehatan raya no.12, rt.10/rw.6, 11, bintaro, kota jakarta selatan",ChIJt____1DwaS4RX_eDTTWVP_k,1707.3559818520355
indomaret kodam bintaro,4.4,82,-6.2590333,106.7597615,"pqr5+9wp, jl. bintaro permai, rt.4/rw.3, pesanggrahan, kota jakarta selatan",ChIJs2ElFvjwaS4RxGz06AXOrTg,756.1842650131704
indomaret ciputat raya 2,4.4,22,-6.2463603,106.7796743,"jl. raya ciputat, rt.8/rw.4, kby. lama utara, kota jakarta selatan",ChIJfYz0UxrxaS4RDiV8YKP8J24,2092.018662778034
indomaret ciledug petukangan,4.5,30,-6.236263,106.74756,"jl. ciledug raya no.6b, rt.10/rw.2, petukangan utara, kota jakarta selatan",ChIJzQet4L7waS4RFeApilyOjfw,2398.602718561981
indomaret bungur raya2 {fuff},4,18,-6.2450426,106.780055,"jalan bunguran, rt.12/rw.2, kby. lama sel., kota jakarta selatan",ChIJ_46xkBrxaS4ReC4bR5CD23A,2183.4581901484
indomaret bintaro mulia.,2,2,-6.2609562,106.7672112,"jl. rc. veteran raya no.2, rt.10/rw.10, bintaro, kota jakarta selatan",ChIJcQydolXwaS4RhUhvgR38H7M,1110.630337759442
indomaret saidi raya,4.2,13,-6.241212699999999,106.7563251,"jl. m.saidi raya no: 62 rt. 009 / rw. 01, petukangan selatan, pasanggrahan, rt.7/rw.5, petukangan sel., kota jakarta selatan",ChIJe35tSOjwaS4R6QeisbhjlkM,1397.4228107459303
indomaret,4.7,7,-6.2534879,106.7758737,"jl. bintaro raya no.17, rt.013/rw.10, kby. lama sel., kota jakarta selatan",ChIJY1VVVQTxaS4RtmETuVP403E,1559.3499755720595
indomaret spbu ciputat. t04d,4.9,7,-6.2479081,106.7781297,"jl. ciputat raya no.12, rt.8/rw.8, kby. lama utara, kota jakarta selatan",ChIJh3nZSBvxaS4RZ-S7enqBkV0,1877.2406686947534
indomaret ciputat 18,4.1,69,-6.2638128,106.7750009,"pqpg+f2c, jl. raya ciputat, rt.6/rw.1, pd. pinang, kota jakarta selatan",ChIJQzFdk6vxaS4Ri6I1vWvx4_s,1923.654674861828
indomaret h. muhi,4.2,70,-6.2666653,106.7706362,"jl. haji muhi raya, rt.10/rw.4, pondok pinang, kebayoran lama, jl. h. muhi raya no.39, rt.10/rw.4, pd. pinang, kota jakarta selatan",ChIJTfxSM1PwaS4RgYyvQDCry1A,1849.5467578619002
indomaret cipulir 1. t2z0,4.2,186,-6.235679999999999,106.7734791,"jl. cipulir i no.4, rt.12/rw.4, cipulir, kota jakarta selatan",ChIJy6BN4CDxaS4RsVFxeRXbZhc,2276.445416385085
indomaret pesanggrahan bintaro,3.6,14,-6.250045900000001,106.7566562,"jl. garuda no.27, rt.5/rw.6, pesanggrahan, kota jakarta selatan",ChIJD9RtOvDwaS4RhDJlnkZFfoE,632.4959589452283
indomaret pesanggrahan permai,3.9,15,-6.237529299999999,106.7545527,"jl. pesanggrahan iv, rt.1/rw.7, petukangan sel., kota jakarta selatan",ChIJz6qqqsnwaS4RxD9ldK9oKKo,1851.443372201567
indomaret darul fallah 2,4.5,238,-6.235983099999999,106.7512009,"jl. masjid darul falah no.13, rw.2, petukangan utara, kota jakarta selatan",ChIJgQybDsHwaS4R6ga_XdZJ78Q,2182.2273230959236
indomaret swadarma 2 {tc5e},4,98,-6.236108,106.7608682,"jl. swadarma raya blok haji nuh 1 no.9, rt.10/rw.3, ulujami, kota jakarta selatan",ChIJl0Lx7NzwaS4RvKVM6oOutyw,1830.1815003868699
indomaret rc veteran,4.4,223,-6.2645803,106.7664311,"jl. rc. veteran raya jl. dahlia no.42e, rt.9/rw.3, bintaro, kota jakarta selatan",ChIJUfoIE1TwaS4RtWJPNqpLxvY,1433.2816248008533
indomaret damai pesanggrahan,4.2,9,-6.242483699999999,106.7558974,"jl. damai no:71 rt 005/ rw 005, petukangan selatan, pasanggrahan, rt.7/rw.5, south petukangan, south jakarta city",ChIJcwAAAOnwaS4RyejTwt6YERQ,1294.65996951424
indomaret,5,1,-6.242818199999999,106.7519549,"jl. kemajuan no.40, rw.2, petukangan sel., kota jakarta selatan",ChIJZetr6vrxaS4RsX9Sa2zGjK0,1533.8621825682183
indomaret ciledug raya 2,4.3,9,-6.238261,106.7717106,"jl. seskoal no.11, rt.8/rw.11, cipulir, kota jakarta selatan",ChIJ6aVHOCDxaS4R6MCZegYiQ0Q,1929.2043523242203
indomaret ciledug sangrilla,4,1,-6.2366825,106.7501446,"jl. ciledug raya no.12a, petukangan selatan, pesanggrahan, rt.1/rw.3, south petukangan, south jakarta city",ChIJbfGEHcHwaS4RxKnoSu1bIxk,2183.7948011594767
indomaret saidi raya 2. tckr,4.3,121,-6.2451289,106.7569883,"no., jl. m. saidi raya no.54, rt.1/rw.5, petukangan sel., kota jakarta selatan",ChIJAZgxPO_waS4RSgVSHG9MFBc,980.8208785239918
indomaret ciledug raya. trl0,4.3,256,-6.2364187,106.7579387,"jl. ciledug raya no.51, rt.6/rw.4, petukangan utara, kota jakarta selatan",ChIJCfldOcPwaS4RtrLi0yMazkU,1842.8082512757003
indomaret damai 2 to1u,3.9,77,-6.246344,106.7517615,"jl. damai raya no.17, rt.12/rw.2, petukangan sel., kota jakarta selatan",ChIJ8QWqFezwaS4R_5w0mAxs9dU,1306.014022449832
indomaret ulujami,3.9,89,-6.2410821,106.7629435,"jl. ulujami raya no.11, rt.11/rw.5, ulujami, kota jakarta selatan",ChIJ4___P-fwaS4Ra-rEZZq9-CM,1280.4667599540612
indomaret depsos raya,4.3,294,-6.2635979,106.7636982,"jl. depsos raya no.4, rw.1, bintaro, kota jakarta selatan",ChIJfdJDkFbwaS4RzRPhnmq9ySw,1247.2547895271648
indomaret al mubarok 1,4.6,80,-6.239336199999999,106.7710655,"jl. al mubarok 1 no.14, rt.8/rw.6, cipulir, kota jakarta selatan",ChIJuVSpxN_waS4Rm819BJDCdw0,1790.3258949175085
indomaret spbu bintaro,4.6,48,-6.261597099999999,106.7569951,"pqq4+8rr, unnamed road, rt.6/rw.3, pesanggrahan, kota jakarta selatan",ChIJEf3pk_rxaS4R4b0T-ousRiQ,1138.3626063987924
indomaret,5,3,-6.2375076,106.7638955,"jl. ciledug raya no.59, rt.1/rw.3, ulujami, kota jakarta selatan",ChIJSaRPzt3waS4R3DqqT8nucVY,1687.6575082923118
indomaret delman utama. {f763},4,123,-6.247976299999999,106.7728671,"jl. delman utama, rt.2/rw.11, kby. lama utara, kota jakarta selatan",ChIJR9-Fph3xaS4R5_wCOsFGSn0,1324.5861670850477
indomaret pesanggrahan bintaro (tp12),4.1,20,-6.254884199999999,106.7566629,"jalan uluhjami, rt.12/rw.6, pesanggrahan, rt.12/rw.6, pesanggrahan, rt.12/rw.6, pesanggrahan, kota jakarta selatan",ChIJex_w2-_waS4R6VXC2vkXSFA,624.5765623017588
indomaret puspita raya,4.5,124,-6.263565799999999,106.7568792,"jl. bintaro puspita raya no.9, rt.9/rw.2, pesanggrahan, kota jakarta selatan",ChIJN6SvsVnwaS4R7Dvnqx_sr4M,1341.055062122501
indomaret peninggaran raya,4.2,18,-6.2443344,106.7725693,"jl. peninggaran raya no.9, kby. lama utara, kota jakarta selatan",ChIJmemSdh7xaS4R82TubBojfuI,1500.0606209129344
indomaret kebayoran lama 3,4.5,24,-6.2330232,106.7804064,"jl. raya kby. lama no.227, rt.10/rw.1, grogol sel., kota jakarta selatan",ChIJob7ukyTxaS4RigRph3C5HUU,2990.125595873447
indomaret ciputat raya 5,4,27,-6.2711724,106.7755201,"indomaret, jl. ciputat raya no.5, rt.1/rw.6, pd. pinang, kota jakarta selatan",ChIJmeRBFrLxaS4RmHuZnxbwxI8,2567.5391106623915
indomaret sultan iskandar muda,4.2,95,-6.2511828,106.7813003,"jl. sultan iskandar muda no.9, rt.8/rw.1, kby. lama sel., kota jakarta selatan",ChIJ74HObQXxaS4RUip6zNyV5gE,2160.904317327423
indomaret (bintaro utama),4.9,8,-6.2710224,106.7578861,"jl. taman bintaro no.194, rt.8/rw.11, bintaro, kota jakarta selatan",ChIJtXtyLz_xaS4RNegL6qVJ54I,2100.023688109445
indomaret inpres pertukangan. txtt,4,7,-6.2431066,106.7485969,"no., jl. inpres no.54, rt.14/rw.2, petukangan sel., kota jakarta selatan",ChIJawlqH-vwaS4ROFHJDR7K8YI,1797.1930433076514
indomaret kebayoran lama 1,4.2,373,-6.2381749,106.7808075,"jl. raya kby. lama no.4, rt.2/rw.1, kby. lama utara, kota jakarta selatan",ChIJodfvliLxaS4RpMCXWAnHq3Q,2639.4726389508473
indomaret,4.7,3,-6.265670699999999,106.7753023,"rt.5/rw.2, pd. pinang, kota jakarta selatan",ChIJBXn-SFTxaS4R7R3uiSMUobE,2087.8975969436588
indomaret damai pesanggrahan,4.4,102,-6.2487206,106.754172,"jl. damai raya no.5, rt.5/rw.5, petukangan sel., kota jakarta selatan",ChIJL-ueae7waS4RrdvbPbIBUlw,943.9767292768629
indomaret ulujami 2,4.3,106,-6.2475986,106.7632979,"jl. ulujami raya jl. h. buang no.gg, rt.1/rw.7, ulujami, kota jakarta selatan",ChIJ4___P-fwaS4RZ-EO8PKFun8,574.0417902980984
indomaret,4.3,10,-6.2724123,106.7527205,"jl. bintaro utama i no.kav 9, rt.4/rw.8, bintaro, kota jakarta selatan",ChIJq8HgY0PwaS4R5UY58R60CRk,2426.7247845711263
