nama_tempat,rating_tempat,user_ratings_total,latitude,longitude,alamat_tempat,place_id,distance
alfamart,4,5,-6.2777493,106.8270138,"jl. pejaten barat raya kel no.36, rt.6/rw.3, ragunan, kota jakarta selatan",ChIJ8_uaqH3zaS4Rh21wCL2tD_g,0
alfamart,4.6,72,-6.277224899999999,106.8204814,"jl. ampera raya no. 120a, rt. 002/010 kel, rt.2/rw.10, ragunan, kota jakarta selatan",ChIJP1_Dhf3zaS4Rusdc7wMlXd8,0
alfamart,4.2,66,-6.2457614,106.8258046,"jl. mampang prpt. raya kel no.58 a, rt.9/rw.3, tegal parang, kota jakarta selatan",ChIJWVXFdyLzaS4R8xNLa-VEm_w,0
alfamart mampang prapatan 2,4.2,180,-6.2433977,106.8291506,"jl. mampang prapatan ii no.19, rt.10/rw.2, mampang prpt., kota jakarta selatan",ChIJv7kzTtvzaS4RPboho4y1LBs,0
alfamart,3.8,39,-6.243284,106.8259296,"jl. mampang prpt. raya kel no.18, rt. 06/03, rt.6/rw.3, mampang prpt., kota jakarta selatan",ChIJ5743TtvzaS4RaNTeZ8xL7Gw,0
alfamart,5,3,-6.2392783,106.832538,"jl. gatot subroto no.kav 56, rt.1/rw.4, kuningan tim., kota jakarta selatan",ChIJXb2FxfXzaS4RMmmtYeQEE18,0
alfamart tegal parang 2,4.2,343,-6.2472825,106.8318862,"jl. tegal parang sel. no.3, rt.4/rw.2, tegal parang, kota jakarta selatan",ChIJyxel_CHzaS4RK3olku7tsH8,0
alfamart,5,1,-6.2435925,106.8322469,"jl. tegal parang utara no.23a, rt.15/rw.007, kel, kota jakarta selatan",ChIJ7yB92wvzaS4RB20MfN2CxwI,0
alfamart tegal parang 3,4,148,-6.2436208,106.8322451,"qr4j+hv3, jl. tegal parang utara, rt.4/rw.7, mampang prpt., kota jakarta selatan",ChIJfecMjMTzaS4R4fJ9fakjI5Q,0
