nama_tempat,rating_tempat,user_ratings_total,latitude,longitude,alamat_tempat,place_id,distance
alfamart,4.3,118,-6.228025,106.7785565,"jl. raya kby. lama no.37, rt.5/rw.007 kel, grogol sel., kota jakarta selatan",ChIJl8UlGdXxaS4Rzp4Cn0GDDRY,0
alfamart,4.3,12,-6.220866099999999,106.7786611,"jl. raya kby. lama kel no.60, rt.7/rw.2, grogol utara, kota jakarta selatan",ChIJTXm4acHxaS4RKHXcYl6lbG4,0
alfamart,4.5,71,-6.2256975,106.7750044,"jl assirot rt 12/1 kel, rt.12/rw.1, sukabumi sel., kota jakarta selatan",ChIJiRXWFynxaS4RMfZt6bXsEeI,0
alfamart panjang cidodol 10,4.6,87,-6.226878399999999,106.7720727,"9, jl. panjang cidodol no.1, rw.9, sukabumi sel., kota jakarta selatan",ChIJye3X2v_xaS4R_nF5CHsgfqM,0
alfamart,4.1,12,-6.266555299999999,106.774843,"jl. ciputat raya kel no.101, rw.4, pd. pinang, kota jakarta selatan",ChIJS00uRKzxaS4RfR-cjilSvTE,0
alfamart,0,0,-6.2644372,106.7750567,"jl. ciputat raya no.25a, rt.6/rw.1, pd. pinang, kota jakarta selatan",ChIJNZ_TjKvxaS4RSpGgi-UQMHE,0
