nama_tempat,rating_tempat,user_ratings_total,latitude,longitude,alamat_tempat,place_id,distance
alfamart satrio,4.7,12,-6.2256225,106.8301711,"jl. prof. dr. satrio no.9, rt.7/rw.2, kuningan, kuningan tim., kota jakarta selatan",ChIJRSP9X8HzaS4ROIFGu7jBrKg,0
alfamart,0,0,-6.22884,106.83263,"ariobimo sentral, jl. h. r. rasuna said no.kel, rt.1/rw.2, kuningan, kuningan tim., kota jakarta selatan",ChIJj_61hA3zaS4RYO2Bom0a2e0,0
alfamart,4.7,11,-6.218932499999999,106.8302356,"jl.hr. rasuna said kav. 3 - 5 kel, rt.6/rw.7, kuningan, setia budi, kota jakarta selatan",ChIJXVCj6unzaS4R3_PYMijRI8o,0
alfamart,4.3,153,-6.2553617,106.790579,"jl. radio dalam raya i no.kel, rt.3/rw.8, gandaria utara, kota jakarta selatan",ChIJJ1zO0dPxaS4RjfHBVEeJ5eE,0
alfamart,4.1,68,-6.259331,106.789079,"jl. radio dalam raya kel no.86, rt.5/rw.14, gandaria utara, kota jakarta selatan",ChIJ4x6Kt6DxaS4RTzwpsJlYZ8Q,0
alfamart,4.5,264,-6.2506507,106.793953,"jl. petogogan i, rt. 003/011 kel, rt.1/rw.1, petogogan, kota jakarta selatan",ChIJT0UQ-xzxaS4Rbkmahws1Wiw,0
alfamart,4.6,5,-6.2600554,106.796534,"jl. fatmawati raya no.kel, rt.4/rw.6, cilandak bar., kota jakarta selatan",ChIJXTKX4rjxaS4RKHvkQIrJHpY,0
alfamart petogogan raya,4.6,96,-6.254885799999999,106.796434,"jl. petogogan ii no.15a-b, jl. petogogan ii, rt.8/rw.6, pulo, south jakarta city",ChIJs-iJX73xaS4RJlH2mmqlobE,0
alfamart,4,20,-6.258272300000001,106.7839248,"jl. tanah kusir ii no.65, rt.3/rw.011 kel, kby. lama sel., kota jakarta selatan",ChIJEzQd4evxaS4RbvtHCITy4Jw,0
