nama_tempat,rating_tempat,user_ratings_total,latitude,longitude,alamat_tempat,place_id,distance
indomaret,4.1,57,-6.2483714,106.7903916,"jl. gandaria 1 no.67, rt.2/rw.8, kramat pela, kota jakarta selatan",ChIJXUBFcBLxaS4RdvT3g4SaRRs,0
indomaret petogogan,4.2,21,-6.2503084,106.7941812,"jl. petogogan no.18, gandaria utara, kebayoran baru, pulo, rt.11/rw.7, rt.11/rw.7, pulo, kota jakarta selatan",ChIJ94ljMXPxaS4RH5R1BnmpJP8,0
indomaret kh ahcmad dahlan. {twxj},4.1,27,-6.2458778,106.7920332,"qq3r+jrr, jalan kh. achmad dahlan, rt.3/rw.1, kramat pela, kota jakarta selatan",ChIJuxnwDxPxaS4R4BeT2kbalvE,0
indomaret radio dalam. t06c,4.2,18,-6.2523025,106.7913861,"jl. radio dalam raya blok haji hamali no.22, rt.1/rw.9, gandaria utara, kota jakarta selatan",ChIJD3ss9gzxaS4RA85t5OGeHsk,0
indomaret panglima polim 106,4.7,29,-6.2476908,106.7976133,"jl. panglima polim no.107, rw.5, b-c, kota jakarta selatan",ChIJI3U5C2XxaS4RdRRpbU-heos,0
indomaret setiabudi 17 ttap,4.7,9,-6.2104472,106.8230337,"jl. setiabudi raya no.17, rt.2/rw.2, kuningan, karet kuningan, kota jakarta selatan",ChIJT8CQPFb1aS4RK8qucus35Ww,0
indomaret (tokx),0,0,-6.206626099999999,106.8267823,"jl. setia budi viii no.10, rt.2/rw.3, kuningan, setia budi, kota jakarta selatan",ChIJq1gLE__1aS4RWeHN-mgTXGM,0
indomaret convenience store point,4,25,-6.2048824,106.8226389,"wisma indosemen lantai gf/annex kav. 70-71, jl. jenderal sudirman, rt.3/rw.3, kuningan, setia budi, kota jakarta selatan",ChIJJ5m3hBz0aS4RBJ9_gwBC4gk,0
indomaret the peak - tapq,0,0,-6.2105197,106.8242588,"qrqf+rj4, the peak jalan setiabudi raya, rt.2/rw.2, kuningan, setia budi, kota jakarta selatan",ChIJ_1BcKv_1aS4Rlooh3g26uJc,0
indomaret plus,0,0,-6.208247399999999,106.8327765,"qrrm+p42, rt.8/rw.2, guntur, south jakarta city",ChIJZU13Dof1aS4RXIGm2TLCTWY,0
indomaret menara imperium (t7xu),4.6,15,-6.2101278,106.8312488,"menara imperium, jl. h. r. rasuna said no.1, rt.1/rw.6, guntur, kota jakarta selatan",ChIJHYztEg_0aS4RoD35swJ40H4,0
indomaret point stasiun mrt dukuh atas,5,1,-6.201634599999999,106.822607,"qrxf+82w, taman dukuh atas jl. jenderal sudirman, rt.10/rw.20, kebon melati, central jakarta city",ChIJ_ZiOif71aS4RT1bOaYGVvB8,0
