nama_tempat,rating_tempat,user_ratings_total,latitude,longitude,alamat_tempat,place_id,distance
indomaret taman margasatwa,4.3,21,-6.2892776,106.8242394,"jalan taman margasatwa no.18a, jati padang, rt.6/rw.1, ragunan, kota jakarta selatan",ChIJ2fZhrgTyaS4Rl1uCPiHU63Q,0
indomaret spbu,4.8,19,-6.2905671,106.8235708,"jl. warung jati barat no.28, rt.5/rw.1, ragunan, kota jakarta selatan",ChIJC4P6jYjzaS4RmEFhDQhpE7U,0
raya ragunan indomaret,4.1,17,-6.2858816,106.8301102,"jl. raya ragunan no.19, rt.2/rw.7, jati padang, kota jakarta selatan",ChIJBS7mhhDyaS4RwQ24c_CL25w,0
indomaret jatipadang no 2,4.4,204,-6.287836299999999,106.8293824,"jl. jatipadang utara no.1, rt.7/rw.9, jati padang, kota jakarta selatan",ChIJBa5dUV_zaS4Rpz5v0gMy_nU,0
indomaret - tower damar,4.2,10,-6.257493999999999,106.8528125,"pvr3+x4w, rt.9/rw.4, rawajati, south jakarta city",ChIJn9W6dvPzaS4R-cPh4bkgO1g,0
indomaret tower rafles,0,0,-6.2572773,106.850916,"tower rafles t4vn, kalibata city, apt",ChIJXYGF0a_zaS4RaVDjPs-LMYk,0
indomaret tower cendana,4.8,5,-6.2584634,106.8533232,"jl. rawajati barat no.8, rw.4, rawajati, kota jakarta selatan",ChIJv2LFq1LyaS4RTp3YYUId3jg,0
indomaret of kalibata city,4.1,14,-6.256166,106.8533404,"apartemen kalibata city, tower gaharu, at 01-02, jalan kalibata raya, rawajati, pancoran, rt.9/rw.4, rawajati, kota jakarta selatan",ChIJeYYMX63zaS4RoKELlWfnU9Q,0
indomaret of pengadegan,3.9,65,-6.2516495,106.849876,"jl. pengadegan selatan viii no.5b, rt.9/rw.5, pengadegan, kota jakarta selatan",ChIJPRf2ebHzaS4R2AqgbPWyqrI,0
indomaret point stasiun kalibata,4.4,27,-6.255365599999999,106.8549931,"pvv3+vx5, jl. rawajati bar., rt.6/rw.7, rawajati, kota jakarta selatan",ChIJzXZzEq3zaS4REp5urTglWeE,0
indomaret tower 3,0,0,-6.2523677,106.8615916,"apartemen pancoran riverside tower 3, jl, jl. pengadegan timur i no.30, rt.6/rw.1, pengadegan, south jakarta city",ChIJV7ZuexPzaS4Raja2xYYiJ_I,0
indomaret tower 2,0,0,-6.2516153,106.861321,"pvx6+9g, pengadegan, south jakarta city",ChIJuzWu8LvzaS4Ra3ud2A7lDHo,0
indomaret apartemen pancoran riverside ftnt,4.4,16,-6.251923499999999,106.8616752,"jl. pengadegan timur i no.30, rt.6/rw.1, pengadegan, kota jakarta selatan",ChIJT9K7ZKnzaS4RYVbkqs38TuU,0
indomaret rawajati timur ii,4.4,171,-6.2599244,106.8548204,"jl. rawajati timur ii no.6a, rt.6/rw.8, rawajati, kota jakarta selatan",ChIJgxhagUnzaS4RvD_Z_w12BOo,0
