nama_tempat,rating_tempat,user_ratings_total,latitude,longitude,alamat_tempat,place_id,distance
alfamart,0,0,-6.266535999999999,106.8103135,"jl. pelita no.99a, rt.8/rw.7, cipete utara, kota jakarta selatan",ChIJI33nWifxaS4RzKQwmLH81wY,802.9734436784488
alfamart,4.3,246,-6.2523984,106.8145319,"jl. bangka raya kel no.101, rt.2/rw.1, pela mampang, kota jakarta selatan",ChIJdQvH69nxaS4RbrLohgHukIQ,1077.335502537277
alfamart,4.2,17,-6.2542811,106.8012815,"jl. darmawangsa vi no.45, rt, rt.5/rw.1, pulo, kota jakarta selatan",ChIJubtXt3bxaS4RG8SDqsnSF-U,960.9474125111109
alfamart,4,5,-6.258382999999999,106.8253662,"jl. duren bangka no.31, d no.kel, rt.6/rw.4, bangka, kota jakarta selatan",ChIJSxYbySzyaS4R2syLNG02aQQ,1915.6162670775116
alfamart,4.6,5,-6.2600554,106.796534,"jl. fatmawati raya no.kel, rt.4/rw.6, cilandak bar., kota jakarta selatan",ChIJXTKX4rjxaS4RKHvkQIrJHpY,1277.31221007522
alfamart,3.8,16,-6.2776194,106.801396,"jl. cipete raya no.6, rt.6/rw.3 kel, cipete sel., kota jakarta selatan",ChIJvyXGa5PxaS4RGwSTqw4eyNI,2129.043876473724
alfamart,4.2,66,-6.2457614,106.8258046,"jl. mampang prpt. raya kel no.58 a, rt.9/rw.3, tegal parang, kota jakarta selatan",ChIJWVXFdyLzaS4R8xNLa-VEm_w,2495.294909584561
alfamart,3,8,-6.2483201,106.7900754,"jl. gandaria i no.04, rt. 010 kel, rt.1/rw.8, kramat pela, kota jakarta selatan",ChIJ9cTCcxLxaS4RIQU5nzRwbcU,2356.461205570034
alfamart,4,6,-6.247622199999999,106.7950681,"jl. barito ii no.kel, rt.8/rw.5, kramat pela, kota jakarta selatan",ChIJ6fv_N23xaS4R8O7J0wDiRO4,1965.2796089549822
alfamart,4.7,7,-6.2662632,106.8239456,"jl. kemang timur no.50, rt.9/rw.003 kel, bangka, kota jakarta selatan",ChIJVSxA1S7yaS4RZ9xhBDqwsbI,1900.6732063069553
alfamart,4.6,16,-6.267619600000001,106.7970639,"jl. rs. fatmawati raya kel no.17 rt 002/002, rt.2/rw.2, gandaria sel., kota jakarta selatan",ChIJG1OrTJjxaS4Rh-es9t_IY2w,1505.3813042100212
alfamart,4,2,-6.253431399999999,106.8216615,"jl. bangka xi c kel no.26, rt.11/rw.10, pela mampang, kota jakarta selatan",ChIJ87K7nWvzaS4Rle3PP96wwFg,1653.0922486493998
alfamart mangga raya,4.6,45,-6.2706697,106.7969812,"rt.1/rw.4, gandaria sel., kota jakarta selatan",ChIJjRUYeR_xaS4RGqLMHkq13co,1733.1006480412236
alfamart,4.3,153,-6.2553617,106.790579,"jl. radio dalam raya i no.kel, rt.3/rw.8, gandaria utara, kota jakarta selatan",ChIJJ1zO0dPxaS4RjfHBVEeJ5eE,1993.045750204099
alfamart,3.5,12,-6.2440528,106.8161758,"jl. bangka raya kel no.31 a, rt.5/rw.5, pela mampang, kota jakarta selatan",ChIJQQRLPWLxaS4Rw_WIE4_HVMw,1952.7412451571322
alfamart,4.4,24,-6.2572531,106.8177386,"jl. kemang utara, no. 12 d-e, rt. 006/005, kel, rt.6/rw.1, bangka, kota jakarta selatan",ChIJtQRU4H_xaS4R4f3Hqd6dnFE,1100.3621716602106
alfamart,4.6,27,-6.245343399999999,106.8012186,"jl. melawai ( blok m mall kel, rt.3/rw.1, melawai, kota jakarta selatan",ChIJgYNzkW7xaS4RAyBciUPKZRg,1763.8622397734562
alfamart yado 3,4,4,-6.255731399999999,106.790674,"rt.2/rw.8, gandaria utara, kota jakarta selatan",ChIJqza5lwvxaS4RLUPjdPF0cVI,1973.3395396440803
alfamart,4.5,264,-6.2506507,106.793953,"jl. petogogan i, rt. 003/011 kel, rt.1/rw.1, petogogan, kota jakarta selatan",ChIJT0UQ-xzxaS4Rbkmahws1Wiw,1855.7383362146516
alfamart,4.2,283,-6.2491889,106.8186279,"jl. bangka ii kel no.1a, rt.8/rw.3, pela mampang, kota jakarta selatan",ChIJ-dormaPzaS4RlalyMly0C5M,1647.7297777896072
alfamart,4.5,24,-6.259575099999999,106.8022096,"jl. damai v rt. 01 kel, rt.2/rw.8, cipete utara, kota jakarta selatan",ChIJ-zEskJ3xaS4R_EqzP6LK7NA,649.3068727947415
alfamart petogogan raya,4.6,96,-6.254885799999999,106.796434,"jl. petogogan ii no.15a-b, jl. petogogan ii, rt.8/rw.6, pulo, south jakarta city",ChIJs-iJX73xaS4RJlH2mmqlobE,1392.9132638760138
alfamart,4.5,13,-6.246897499999999,106.7898721,"jl. gandaria 1 kel no.41, rt.2/rw.3, kramat pela, kota jakarta selatan",ChIJM-mfsy_xaS4RLeBYt92_-zA,2463.118380855881
alfamart bangka 2,4.3,175,-6.2433743,106.8156896,"jl. bangka raya no.26, rt.5/rw.5, pela mampang, kota jakarta selatan",ChIJJcKfPGLxaS4RGLvlj1PN8YY,1996.8869945212969
alfamart,3.8,13,-6.2510088,106.8216417,"jl. pondok jaya vi no.31 rt.00 kel, rt.6/rw.6, pela mampang, kota jakarta selatan",ChIJmdxMydLzaS4R3PTMkWwbsm8,1781.0309004157127
alfamart,4.2,120,-6.245465,106.8186523,"jl. bangka ii kel no.29l, rt.17/rw.2, pela mampang, kota jakarta selatan",ChIJE2FoiNjzaS4RkuhZJgb9Stg,1964.0127624299446
alfamart,4.3,76,-6.267047499999999,106.792991,"jl. madrasah kel no.48, rt.8/rw.1, gandaria sel., kota jakarta selatan",ChIJ-xBaWJ_xaS4RSieZKuw5ftg,1859.2912363463513
alfamart,3.6,14,-6.2730548,106.8150264,"jl.kemang selatan x11, kel, rt.11/rw.4, cilandak tim., kota jakarta selatan",ChIJXcA3nYnxaS4RsNTOqAWbAAw,1675.1822212211343
alfamart,3.3,3,-6.2657246,106.7998702,"jl. abdul majid raya kel no.6a, rt.11/rw.2, cipete utara, kota jakarta selatan",ChIJw8JIYpnxaS4Rk_cRQR3bxvY,1130.643706532612
alfamart,3.8,39,-6.243284,106.8259296,"jl. mampang prpt. raya kel no.18, rt. 06/03, rt.6/rw.3, mampang prpt., kota jakarta selatan",ChIJ5743TtvzaS4RaNTeZ8xL7Gw,2684.8457850829304
sumber alfaria trijaya. pt (alfamart),5,4,-6.2670737,106.8019836,"jl. abdul majid raya no.33, rt.11/rw.7, cipete utara, kota jakarta selatan",ChIJu_W4zZvxaS4R-LlOuR9RWhE,1064.6662454989503
alfamart kyai maja,4.5,454,-6.2415428,106.793223,"10, jl. kyai maja no.37, rt.10/rw.7, kramat pela, kota jakarta selatan",ChIJ3XNl2RTxaS4R5Bv0sufWonw,2599.604229509924
alfamart faletehan,4.3,32,-6.2417419,106.8016892,"jl. falatehan i no.30, rt.2/rw.1, melawai, kota jakarta selatan",ChIJM7mhkrDxaS4RCbsQa_-sjAw,2114.403046172083
alfamart,0,0,-6.252799599999999,106.8268128,"jl. mampang prpt. 16 kel no.5, rt.1/rw.6, tegal parang, kota jakarta selatan",ChIJl_om9KjzaS4RGU8Vxu07GBo,2206.4310834284274
alfamart,4.6,72,-6.277224899999999,106.8204814,"jl. ampera raya no. 120a, rt. 002/010 kel, rt.2/rw.10, ragunan, kota jakarta selatan",ChIJP1_Dhf3zaS4Rusdc7wMlXd8,2385.6116929760883
alfamart,4,5,-6.2777493,106.8270138,"jl. pejaten barat raya kel no.36, rt.6/rw.3, ragunan, kota jakarta selatan",ChIJ8_uaqH3zaS4Rh21wCL2tD_g,2902.1509461114497
alfamart,4.1,68,-6.259331,106.789079,"jl. radio dalam raya kel no.86, rt.5/rw.14, gandaria utara, kota jakarta selatan",ChIJ4x6Kt6DxaS4RTzwpsJlYZ8Q,2100.9115998705906
alfamart raya radio dalam,0,0,-6.2623865,106.7887372,"jl. radio dalam raya no.14d, rt.7/rw.10, gandaria utara, kota jakarta selatan",ChIJJ5iWv67xaS4RNxDBDbF5rJs,2159.6918442537167
alfamart kapten tendean 2,3.8,11,-6.240049200000001,106.818981,"jl. kapt. tendean no. 18 b, rt, kel, rt.1/rw.1, pela mampang, kota jakarta selatan",ChIJk9Chmd_zaS4R8JKnx_DYAd4,2491.537194876398
alfamart mampang prapatan 2 (kb48),4,4,-6.2527525,106.8268743,"jl. warung buncit raya no.5, rt.4/rw.6, tegal parang, kota jakarta selatan",ChIJgePHgdHzaS4RcdWxMOdPfeA,2214.6224056896294
alfamart,0,0,-6.240064299999999,106.8042097,"pt pln (persero) kantor pusat, jl. trunojoyo no.kel, rt.6/rw.2, melawai, south jakarta city",ChIJp0jKnE_xaS4ReNrwgJLzaRU,2220.9854608703513
di depan alfamart,5,1,-6.2665447,106.7971267,"jl. rs. fatmawati raya no.33, rw.2, gandaria sel., kota jakarta selatan",ChIJaX-B5jjxaS4RJ2YNF7-2yC0,1432.5216347773057
alfamart kemang selatan raya,4.8,24,-6.273941199999999,106.8189054,"jl. kemang sel. no.4, rw.4, raya, kota jakarta selatan",ChIJoyofGuvzaS4RM0Dyh9j3fPo,1987.8057368083666
alfamart koppeg pt pln,3.9,12,-6.2407841,106.8035925,"jl. trunojoyo no.135, rt.6/rw.2, melawai, kota jakarta selatan",ChIJgZrvVmjxaS4R-CmjwHJTv-o,2157.173704410975
alfa midi,4.5,174,-6.2468046,106.7948782,"qq3v+7xc, jl. barito ii, rt.8/rw.5, kramat pela, kota jakarta selatan",ChIJAS87L23xaS4RE2RaGQ6kKq4,2043.2518346625716
