nama_tempat,rating_tempat,user_ratings_total,latitude,longitude,alamat_tempat,place_id,distance
indomaret soepomo,4.1,16,-6.2325019,106.8444327,"qr9v+2q4, jalan dr. soepomo, rt.1/rw.3, menteng dalam, kota jakarta selatan",ChIJw4Qe95TzaS4R4TukR0p9hZk,1868.6569873981377
indomaret tebet barat raya,4.4,15,-6.2383118,106.850335,"jl. tebet barat ix no.20, rt.5/rw.4, tebet bar., kota jakarta selatan",ChIJBxrDu73zaS4R_jKixhfyWEE,1628.2393936334977
indomaret duren tiga raya. tuoi,4,27,-6.2534709,106.8404797,"jalan duren tiga barat no.32, rt.1/rw.1, duren tiga, pancoran, rt.1/rw.1, pancoran, kota jakarta selatan",ChIJkzb3EMrzaS4RXv7xWnaXfb8,532.5904577453841
indomaret pasar minggu 15b (ffdq),4.5,8,-6.2607737,106.8428871,"jl. raya pasar minggu no.15 a, rt.1/rw.7, kalibata, kota jakarta selatan",ChIJv6HpCt3zaS4R6xwdQSocB24,1379.9498218692072
indomaret,3.6,10,-6.2627434,106.830664,"jl. warung buncit raya no.1 a, rt.5/rw.3, kalibata, kota jakarta selatan",ChIJ420LHDLyaS4RhHEuu5hwBX8,1868.603455656066
indomaret of pengadegan,3.9,65,-6.2516495,106.849876,"jl. pengadegan selatan viii no.5b, rt.9/rw.5, pengadegan, kota jakarta selatan",ChIJPRf2ebHzaS4R2AqgbPWyqrI,1143.546543269567
indomaret,2.3,3,-6.248328,106.8240323,"jl. mampang prapatan vii no.1, rw.3, tegal parang, kota jakarta selatan",ChIJJXUTrNDzaS4RJSFdr933enM,1761.3236974356366
indomaret supomo 2,3.9,40,-6.239277899999999,106.8456902,"jl. prof. dr. soepomo no.02, rt.14/rw.6, tebet bar., kota jakarta selatan",ChIJXRviXL7zaS4RE8cUq9rXJQc,1224.9867631717339
indomaret - tower damar,4.2,10,-6.257493999999999,106.8528125,"pvr3+x4w, rt.9/rw.4, rawajati, south jakarta city",ChIJn9W6dvPzaS4R-cPh4bkgO1g,1723.8701869417441
indomaret pangadegan utara,4.4,142,-6.2459671,106.8555993,"no., jl. pengadegan utara no.12a, rt.6/rw.7, cikoko, kota jakarta selatan",ChIJrevYYKXzaS4RywexQtwJGqY,1755.1138490692501
indomaret kemang utara. tc87,4.4,18,-6.2541381,106.8269373,"jl. kemang utara ix no.1, rt.2/rw.5, duren tiga, kota jakarta selatan",ChIJhxAVNdLzaS4RE36ihgryocM,1561.1536876765927
indomaret,4.6,19,-6.2614906,106.840841,"jl. kalibata tengah no.1a, rt.5/rw.7, kalibata, kota jakarta selatan",ChIJyTF07TXyaS4RYebkKF7u42o,1424.5769436706807
indomaret pancoran barat 7 tfpc,4.8,8,-6.251975799999999,106.8368081,"jl. pancoran barat vii no.9a, rt.8/rw.1, duren tiga, kota jakarta selatan",ChIJEYrs5dDzaS4RJRZWtIRczmM,503.5023878317849
indomaret pancoran 7,4.1,31,-6.2497874,106.8365148,"jl. pancoran barat vii, rt. 013 / rw. 006, pancoran, mampang prapatan, rt.12/rw.6, pancoran, kota jakarta selatan",ChIJY3w000zyaS4RJpAudy3L5V4,399.49203410174346
indomaret tebet timur dalam raya,4.4,11,-6.236383699999999,106.8568272,"jl. tebet timur dalam raya no.29, rt.11/rw.7, tebet tim., kota jakarta selatan",ChIJzddog5jzaS4RM7Gl9dS3Gbs,2313.746009533201
indomaret point,3.3,3,-6.2331067,106.8230684,"patra jasa, jl. gatot subroto, rt.6/rw.3, kuningan, kuningan tim., kota jakarta selatan",ChIJpbNXVUrzaS4Rt_lHfKPzCKM,2548.914543713016
indomaret,0,0,-6.2577016,106.8535744,"tower kalibata cendana, rawajati, kota jakarta selatan",ChIJV9gKwXvzaS4RKk1asM_cBr8,1806.568052890167
indomaret of rawajati,4.1,10,-6.2628099,106.8520926,"pvp2+vrh, jl. rawajati timur, rt.7/rw.6, rawajati, kota jakarta selatan",ChIJPRc3DE7yaS4Rlzq8SQ7YEfE,2063.0664943487545
indomaret tegal parang 2. ts86,3.9,33,-6.2441983,106.8324248,"jl. tegal parang utara no.35, rt.7/rw.4, mampang prpt., kota jakarta selatan",ChIJF1D19sTzaS4Rw9CnBydlgJM,972.4759702092078
indomaret mampang 8. t5wi,3.9,17,-6.2477205,106.8306366,"jalan mampang prapatan viii, rt.03 / rw.02, tegal parang, mampang prapatan, rt.3/rw.2, tegal parang, kota jakarta selatan",ChIJ_xUj9s_zaS4RuolU_sbnxqY,1036.6545580404631
indomaret mt haryono,4.3,3,-6.2422974,106.8551682,"menara mt. haryono, jl. mt. haryono kav 23, rt.12/rw.5, tebet timur, tebet, rt.10/rw.9, tebet tim., kota jakarta selatan",ChIJHQAAwJnzaS4RX1MjemHCBZM,1825.7346443373056
indomaret pancoran barat 34,0,0,-6.251983999999999,106.8367253,"jl. pancoran barat vii no.34, rt.8/rw.6, duren tiga, kota jakarta selatan",ChIJncPt8wXzaS4RDxKhwvnyVpg,510.532543669137
indomaret tegal parang. t986,4.1,9,-6.2464648,106.8322217,"qr3j+cw7, jl. tegal parang, rt.7/rw.5, tegal parang, kota jakarta selatan",ChIJezNcc8XzaS4RsQx_12LcMCA,891.2497906428906
indomaret ciputat raya 2a -b,0,0,-6.239546799999999,106.8263501,"jl. kapten tendean no.34, rt.9/rw.2, kuningan bar., kota jakarta selatan",ChIJR3Z58xPzaS4Rv46cCQ_1uvk,1817.0926036524838
indomaret h.maun,4.2,84,-6.258863799999999,106.8375135,"prrq+c2r, jl. duren tiga selatan, rt.8/rw.2, kalibata, kota jakarta selatan",ChIJI0tOwjTyaS4RLO_bH3X27As,1161.1634178957604
indomaret buncit warung jati. {t8nd},4.4,206,-6.262678699999999,106.8306876,"jl. kalibata tengah xvi no.1, rt.5/rw.9, kalibata, kota jakarta selatan",ChIJcTAiHDLyaS4R0aVLrIbKjmg,1861.16122116332
indomaret warung jati,5,1,-6.2613007,106.8289744,"jl. warung buncit raya no.25, rt.7/rw.3, kalibata, kota jakarta selatan",ChIJSXpPIvDzaS4RKSuxd1gXm2Q,1853.5060906583592
indomaret tebet barat in tk29,4.2,149,-6.2383462,106.847226,"jl. tebet barat dalam ivd no.88, rw.6, tebet bar., kota jakarta selatan",ChIJ7ahV373zaS4Rm9rs7VrGTVg,1404.4200596035375
indomaret tower rafles,0,0,-6.2572773,106.850916,"tower rafles t4vn, kalibata city, apt",ChIJXYGF0a_zaS4RaVDjPs-LMYk,1540.6744300468758
indomaret tebet raya,4.3,37,-6.230342299999999,106.8514366,"jl. tebet raya no.30 a, rt.2/rw.2, tebet bar., kota jakarta selatan",ChIJV7cl6pDzaS4RnpIsEEg4Wik,2404.068317115795
indomaret tower cendana,4.8,5,-6.2584634,106.8533232,"jl. rawajati barat no.8, rw.4, rawajati, kota jakarta selatan",ChIJv2LFq1LyaS4RTp3YYUId3jg,1832.3443050051383
indomaret of kalibata city,4.1,14,-6.256166,106.8533404,"apartemen kalibata city, tower gaharu, at 01-02, jalan kalibata raya, rawajati, pancoran, rt.9/rw.4, rawajati, kota jakarta selatan",ChIJeYYMX63zaS4RoKELlWfnU9Q,1695.3478071739585
kemang timur indomaret,4.2,207,-6.2639511,106.8236563,"jl. kemang timur no.38, rt.8/rw.3, bangka, kota jakarta selatan",ChIJQZigUinyaS4R4ofKanmV2lI,2474.0659435916746
indomaret,0,0,-6.2467067,106.8549365,"rw.7, pengadegan, kota jakarta selatan",ChIJZ0DyfMnzaS4RJ9jFt8abwmQ,1670.0741398981452
indomaret lapangan tembak 3,4,1,-6.2402503,106.8557039,"jl. lapangan tembak no. 08 rt. 02 rw. 10, rt.1/rw.8, east tebet, south jakarta city",ChIJE3_-BaPzaS4Rs0YHJv9N4H0,1977.9418524107261
indomaret plus rasamala,4.1,61,-6.2336278,106.8395619,"jl. rasamala raya no.26, rt.7/rw.9, menteng dalam, kota jakarta selatan",ChIJtaqqauvzaS4RnSCep_ghRMM,1677.5280692270942
indomaret pengadegan timur,4.3,57,-6.248453899999999,106.8587205,"jl. pengadegan timur raya no.2, rt.3/rw.2, pengadegan, kota jakarta selatan",ChIJqUxFMa_zaS4Rb6WsdUlLWrQ,2073.6216403301632
indomaret signature park,4.3,3,-6.242484,106.854727,"mt haryono st no.10, rw.9, east tebet, south jakarta city",ChIJ71RBBiPzaS4RzLWpLbPWU80,1772.7358404999418
indomaret point stasiun kalibata,4.4,27,-6.255365599999999,106.8549931,"pvv3+vx5, jl. rawajati bar., rt.6/rw.7, rawajati, kota jakarta selatan",ChIJzXZzEq3zaS4REp5urTglWeE,1818.8374837845613
indomaret kemang timur raya {t01a},4,13,-6.2681964,106.8239824,"jalan kemang timur, rt.7/rw.3, bangka, mampang prapatan, rt.7/rw.3, bangka, kota jakarta selatan",ChIJ89CaVi_yaS4Rmq471uckjw0,2795.589401907875
indomaret - spbu pancoran tjrt,3.1,10,-6.246947,106.8424352,"qr3r+6x7, rt.1/rw.4, pancoran, south jakarta city",ChIJpzdhkdPzaS4R8PAP1nFVLYE,336.30029576658495
indomaret pondok jaya mampang,4.4,111,-6.2494907,106.8214751,"jl. pondok jaya vi no.6, rt.6/rw.6, pela mampang, kota jakarta selatan",ChIJf2NThW7zaS4RXQqG3ssDz7w,2045.319182202982
indomaret asem baris,4.1,23,-6.2389963,106.8602569,"jl. asem baris raya no.1, rt.6/rw.13, kb. baru, kota jakarta selatan",ChIJuZeA4KHzaS4RO8kOMnZzjnw,2489.7108750876896
indomaret asembaris 2. tc71,3.8,10,-6.2292648,106.8590207,"jalan asem baris, rt.5/rw.5, kebon baru, tebet, rt.5/rw.5, kb. baru, kota jakarta selatan",ChIJ95g2h5vzaS4R0qUPfUiXjys,3018.7074759312586
indomaret mampang 7,4.1,207,-6.248328099999999,106.824029,"jl. mampang prapatan vii no.30, rt.1/rw.3, tegal parang, kota jakarta selatan",ChIJAxkWrNDzaS4RyfXBmyZF8qA,1761.6880883222154
indomaret plus tebet timur dalam,4.5,255,-6.2403194,106.8557598,"jl. tebet timur raya no.29, rt.1/rw.8, tebet tim., kota jakarta selatan",ChIJWRooDKPzaS4R-oR5GrizSpE,1979.7474157581187
indomaret bangka 2b,4.4,293,-6.242254099999999,106.8196646,"jl. bangka ii no.12, rt.5/rw.9, pela mampang, kota jakarta selatan",ChIJR_R8Od_zaS4RTFXXRKEDqVo,2355.6176227165383
indomaret,4.2,421,-6.229205299999999,106.8474494,"jl. prof supomo no 321 blok bz persil no 19, rt.13/rw.2, tebet barat, rt.13/rw.2, tebet bar., kota jakarta selatan",ChIJxf__P5bzaS4RZ7KfkYohoDc,2321.2489865069383
indomaret kalibata utara,4.5,101,-6.2604007,106.837657,"jl. kalibata utara ii no.37, rt.7/rw.7, kalibata, kota jakarta selatan",ChIJiXNZXIjzaS4RjQ-7sFoVCPU,1324.8067519789806
