nama_tempat,rating_tempat,user_ratings_total,latitude,longitude,alamat_tempat,place_id,distance
alfamart,5,4,-6.2534671,106.7755935,"jl. bintaro raya no.21a, rt.11/rw.10, kby. lama sel., kota jakarta selatan",ChIJcydB66nxaS4RsYN_8dfR-hc,0
alfamart,4.4,26,-6.257043599999999,106.7772368,"jl. raya ciputat no.3 b rt.003 kel, rt.3/rw.10, kby. lama sel., kota jakarta selatan",ChIJGWL41wbxaS4R-IwO3XiRIaU,0
alfamart,4.8,13,-6.247626299999999,106.7785018,"jl. ciputat raya, rt. 8/8 kel, rt.8/rw.8, kby. lama sel., kota jakarta selatan",ChIJMyzoc8PxaS4Rx4Pb25aRaVI,0
alfamart,4.6,56,-6.250438,106.7817332,"jl. sultan iskandar muda no.72, rt.10/rw.2, kby. lama sel., kota jakarta selatan",ChIJP3zxrTPxaS4R58_AUM2UGGA,0
alfamart,4.3,246,-6.2523984,106.8145319,"jl. bangka raya kel no.101, rt.2/rw.1, pela mampang, kota jakarta selatan",ChIJdQvH69nxaS4RbrLohgHukIQ,0
alfamart,4.2,283,-6.2491889,106.8186279,"jl. bangka ii kel no.1a, rt.8/rw.3, pela mampang, kota jakarta selatan",ChIJ-dormaPzaS4RlalyMly0C5M,0
alfamart,4.4,24,-6.2572531,106.8177386,"jl. kemang utara, no. 12 d-e, rt. 006/005, kel, rt.6/rw.1, bangka, kota jakarta selatan",ChIJtQRU4H_xaS4R4f3Hqd6dnFE,0
