nama_tempat,rating_tempat,user_ratings_total,latitude,longitude,alamat_tempat,place_id,distance
indomaret ciputat raya ta3p,4.3,59,-6.2585712,106.7773998,"jl. ciputat raya no.35, rw.10, kby. lama sel., kota jakarta selatan",ChIJd734LwfxaS4R9GSRMspZ-XE,0
indomaret,4.7,7,-6.2534879,106.7758737,"jl. bintaro raya no.17, rt.013/rw.10, kby. lama sel., kota jakarta selatan",ChIJY1VVVQTxaS4RtmETuVP403E,0
indomaret ciputat 18,4.1,69,-6.2638128,106.7750009,"pqpg+f2c, jl. raya ciputat, rt.6/rw.1, pd. pinang, kota jakarta selatan",ChIJQzFdk6vxaS4Ri6I1vWvx4_s,0
indomaret tanah kusir 2 dalam tt2d,4.4,269,-6.257153,106.784136,"gg. swadaya iii no.18, rt.10/rw.9, kby. lama sel., kota jakarta selatan",ChIJZbLLdm_xaS4R4cgyDKLeE8k,0
indomaret assirot,4.3,156,-6.225558899999999,106.7751594,"jl. assirot no.6a, rt.5/rw.5, grogol sel., kota jakarta selatan",ChIJ8VBSPinxaS4Rsng_u-K88hw,0
kebayoran lama indomaret assirot,4.7,213,-6.2253634,106.7782561,"jl. raya kby. lama no.n 44, rt.7/rw.1, grogol sel., kota jakarta selatan",ChIJeZWj6y7xaS4RkU4hCYZW7ig,0
indomaret kebayoran lama 242,4.5,130,-6.231951899999999,106.7803754,"jl. raya kby. lama no.242, rt.11/rw.1, grogol sel., kota jakarta selatan",ChIJM8eV5iTxaS4RwEvXAASHlko,0
indomaret panjang cidodol 2 (tg26),3.8,8,-6.227386999999999,106.772065,"qqfc+2rv, jl. panjang cidodol, rt.14/rw.6, grogol sel., kota jakarta selatan",ChIJK5X2RyjxaS4RyPDN-Qxm35w,0
