nama_tempat,rating_tempat,user_ratings_total,latitude,longitude,alamat_tempat,place_id,distance
alfamart,4.3,151,-6.216512,106.8278755,"jl. anggrek 3 kel no.25 b, rt.19/rw.2, kuningan, karet kuningan, kota jakarta selatan",ChIJd8d5kgf0aS4RZrS7fXlU-kg,957.8198990277955
alfamart pasar manggis,4.8,5,-6.2140038,106.8427878,"jl. payakumbuh no.56, rt.11/rw.9, ps. manggis, kota jakarta selatan",ChIJ41SXHGn1aS4R33isZf_v_DY,2043.218695442552
alfamart,4.3,66,-6.216337999999999,106.8203685,"jl. bek murad no.7, rt.8/rw.001 kel, kuningan, karet kuningan, kota jakarta selatan",ChIJqxVWcJX1aS4RUAMlnS81uJM,1040.459060279419
alfamart,4,1,-6.2130459,106.825213,"jl. karet belakang barat jl. karbela no.kel, rt.1/rw.2, kuningan, karet kuningan, kota jakarta selatan",ChIJg9H4zDH1aS4Rm3_YlVTAJaY,526.0416912599442
alfamart,0,0,-6.1951594,106.8175115,"jl. thamrin boulevard (gedung thamrin city blok bt/ld1-70 dan bt/ld1-71 kel, kebon melati, central jakarta city",ChIJiZqzblz3aS4RorMSigHzy2E,1692.5143486319819
alfamart,4.7,11,-6.218932499999999,106.8302356,"jl.hr. rasuna said kav. 3 - 5 kel, rt.6/rw.7, kuningan, setia budi, kota jakarta selatan",ChIJXVCj6unzaS4R3_PYMijRI8o,1304.6700070804875
alfamart setiabudibarat,5,1,-6.2104934,106.8230285,"jl. setiabudi raya no.2, rw.2, kuningan, kota jakarta selatan",ChIJRScsryb1aS4RlODMjqPRKNU,341.971070978884
alfamart menteng atas selatan 3,3.5,8,-6.2177142,106.8386021,"qrjq+wc9, rt.9/rw.4, menteng atas, south jakarta city",ChIJ3YwKPTbzaS4RVeL7N3tKQps,1811.9336237152959
alfamart,0,0,-6.213906,106.831112,"jl. h. r. rasuna said no.kav. 3, rt.3/rw.5, setia budi, kota jakarta selatan",ChIJj0q3Toz1aS4RmEbgm7uw19A,901.0040298787953
alfamart,4.3,263,-6.2138855,106.8266392,"jl. karet belakang i no.2, rt.3/rw.4, kuningan, karet, kota jakarta selatan",ChIJUyMhTgb0aS4RgL8lQLR7f34,639.1692738943549
alfamart,2.6,5,-6.216807999999999,106.8179903,"jl. jenderal sudirman kel no.kav. 45-46, rt.3/rw.4, setia budi, kota jakarta selatan",ChIJM7-EqKr2aS4Rv5IqHeB_HY0,1236.5963881495668
alfamart,3.7,18,-6.210939,106.8421901,"jl. menteng wadas timur no. 12, kel no.01, rt.2/rw.1, ps. manggis, kota jakarta selatan",ChIJ65NqKXP0aS4R5fP1Zj0JGls,1899.3150844046074
alfamart,4.4,131,-6.2086877,106.8245274,"jl. setia budi barat no.5, rt. 004/003, rt.5/rw.3, kuningan, setia budi, kota jakarta selatan",ChIJuTCdkAT0aS4RNniucbDH9dc,86.30575304457531
alfamart muria tanjakan,4.6,35,-6.2119276,106.8380365,"jl. muria tanjakan gg. c2 no.6, rt.1/rw.12, ps. manggis, kota jakarta selatan",ChIJ5Si0x671aS4RNBFEQK-tApQ,1473.4324875334808
sumber alfaria trijaya. pt (alfamart),3,1,-6.213625899999999,106.8206906,"jl. penjernihan i no.10, rt.4/rw.2, kuningan, karet, kota jakarta selatan",ChIJo-s9oAH0aS4RVJ8YUgAM_DY,773.6736780094931
alfamart mwtm (k795),4.4,5,-6.210930299999999,106.8421876,"jl. menteng wadas timur no.18b, rt.9/rw.1, ps. manggis, kota jakarta selatan",ChIJH1n1T3P0aS4R6agOTLlpnCg,1898.8936354387886
alfamart,4.8,5,-6.226305,106.8191669,"apartemen taman semanggi, jl. akri kel no.136, rt.8/rw.2, karet semanggi, kota jakarta selatan",ChIJZSNypFjzaS4RiqX0yBCekAw,2109.0594292036835
alfamart karbela 3,4.3,25,-6.2092301,106.8266949,"jl. setia budi tengah no.5, rt.1/rw.1, kuningan, kota jakarta selatan",ChIJNYn7SAf0aS4RXmIS9qwhxQU,192.90398245557657
alfamart karbela 2,3.8,5,-6.2154088,106.8281067,"jl. karbela, gg. anggrek xii kel no.10, rt.18/rw.2, kuningan, karet kuningan, kota jakarta selatan",ChIJAy-tiaj1aS4RDnaS0bHpQiw,851.2057375659587
alfamart satrio,4.7,12,-6.2256225,106.8301711,"jl. prof. dr. satrio no.9, rt.7/rw.2, kuningan, kuningan tim., kota jakarta selatan",ChIJRSP9X8HzaS4ROIFGu7jBrKg,2001.0400923052207
alfamart minangkabau,4.5,146,-6.2125368,106.8445336,"jl. minangkabau barat no.2, rw.10, ps. manggis, kota jakarta selatan",ChIJ2wTpYf71aS4RoHjLXsoGgMw,2186.804748013837
alfamart,3.8,6,-6.217207399999999,106.8442193,"jl.dr. saharjo no. 96, kel no.1, rt.1/rw.7, menteng atas, kota jakarta selatan",ChIJpTDO7ojzaS4Rr4Rj2cGIbD4,2322.1089731770257
alfamart sawah lunto,4.6,169,-6.214008799999999,106.842788,"11, jl. minangkabau barat no.58d, rt.11/rw.9, ps. manggis, kota jakarta selatan",ChIJaSlK6PT1aS4RrBHGJkrlQ1k,2043.4118987646682
alfamart bakrie tower,4.7,6,-6.2193385,106.8344896,"bakrie tower, jl. epicentrum utama raya no.2, rt.2/rw.5, karet kuningan, south jakarta city",ChIJW44xTg70aS4RnoQoC3ewjZY,1598.1765610833647
