nama_tempat,rating_tempat,user_ratings_total,latitude,longitude,alamat_tempat,place_id,distance
indomaret duren tiga raya. tuoi,4,27,-6.2534709,106.8404797,"jalan duren tiga barat no.32, rt.1/rw.1, duren tiga, pancoran, rt.1/rw.1, pancoran, kota jakarta selatan",ChIJkzb3EMrzaS4RXv7xWnaXfb8,0
indomaret pancoran barat 7 tfpc,4.8,8,-6.251975799999999,106.8368081,"jl. pancoran barat vii no.9a, rt.8/rw.1, duren tiga, kota jakarta selatan",ChIJEYrs5dDzaS4RJRZWtIRczmM,0
indomaret pancoran 7,4.1,31,-6.2497874,106.8365148,"jl. pancoran barat vii, rt. 013 / rw. 006, pancoran, mampang prapatan, rt.12/rw.6, pancoran, kota jakarta selatan",ChIJY3w000zyaS4RJpAudy3L5V4,0
indomaret tegal parang. t986,4.1,9,-6.2464648,106.8322217,"qr3j+cw7, jl. tegal parang, rt.7/rw.5, tegal parang, kota jakarta selatan",ChIJezNcc8XzaS4RsQx_12LcMCA,0
indomaret mampang 8. t5wi,3.9,17,-6.2477205,106.8306366,"jalan mampang prapatan viii, rt.03 / rw.02, tegal parang, mampang prapatan, rt.3/rw.2, tegal parang, kota jakarta selatan",ChIJ_xUj9s_zaS4RuolU_sbnxqY,0
indomaret - spbu pancoran tjrt,3.1,10,-6.246947,106.8424352,"qr3r+6x7, rt.1/rw.4, pancoran, south jakarta city",ChIJpzdhkdPzaS4R8PAP1nFVLYE,0
indomaret pisangan baru selatan 2,4.3,4,-6.214658699999999,106.8729981,"qvpf+459, rt.1/rw.15, pisangan baru, east jakarta city",ChIJ37a-bqf1aS4Rp7HQzQh8Awc,0
