nama_tempat,rating_tempat,user_ratings_total,latitude,longitude,alamat_tempat,place_id,distance
indomaret pandan 47,4.6,60,-6.2040209,106.8672455,"jl. pandan no. 47 rt. 11 rw. 12 kel, rt.11/rw.12, south utan kayu, east jakarta city",ChIJc3lpisv1aS4RjyY4vbpNYEw,0
indomaret asem baris,4.1,23,-6.2389963,106.8602569,"jl. asem baris raya no.1, rt.6/rw.13, kb. baru, kota jakarta selatan",ChIJuZeA4KHzaS4RO8kOMnZzjnw,0
indomaret tebet timur dalam raya,4.4,11,-6.236383699999999,106.8568272,"jl. tebet timur dalam raya no.29, rt.11/rw.7, tebet tim., kota jakarta selatan",ChIJzddog5jzaS4RM7Gl9dS3Gbs,0
indomaret lapangan tembak 3,4,1,-6.2402503,106.8557039,"jl. lapangan tembak no. 08 rt. 02 rw. 10, rt.1/rw.8, east tebet, south jakarta city",ChIJE3_-BaPzaS4Rs0YHJv9N4H0,0
indomaret mt haryono,4.3,3,-6.2422974,106.8551682,"menara mt. haryono, jl. mt. haryono kav 23, rt.12/rw.5, tebet timur, tebet, rt.10/rw.9, tebet tim., kota jakarta selatan",ChIJHQAAwJnzaS4RX1MjemHCBZM,0
indomaret signature park,4.3,3,-6.242484,106.854727,"mt haryono st no.10, rw.9, east tebet, south jakarta city",ChIJ71RBBiPzaS4RzLWpLbPWU80,0
indomaret plus tebet timur dalam,4.5,255,-6.2403194,106.8557598,"jl. tebet timur raya no.29, rt.1/rw.8, tebet tim., kota jakarta selatan",ChIJWRooDKPzaS4R-oR5GrizSpE,0
