nama_tempat,rating_tempat,user_ratings_total,latitude,longitude,alamat_tempat,place_id,distance
indomaret,0,0,-6.214337,106.8312134,"wisma budi, jl. h. r. rasuna said no.3, rt.3/rw.1, karet, kota jakarta selatan",ChIJVwsQapH1aS4RRn0qO3oi72c,1051.604205172186
indomaret dr. saharjo,4.2,16,-6.2160036,106.8440714,"jl. dr. saharjo no.109, rt.2/rw.10, manggarai sel., kota jakarta selatan",ChIJk___P4nzaS4R-mx5t36xeEE,508.08899463297394
indomaret soepomo,4.1,16,-6.2325019,106.8444327,"qr9v+2q4, jalan dr. soepomo, rt.1/rw.3, menteng dalam, kota jakarta selatan",ChIJw4Qe95TzaS4R4TukR0p9hZk,1681.1251105693996
indomaret setiabudi 17 ttap,4.7,9,-6.2104472,106.8230337,"jl. setiabudi raya no.17, rt.2/rw.2, kuningan, karet kuningan, kota jakarta selatan",ChIJT8CQPFb1aS4RK8qucus35Ww,2053.465986286134
indomaret tebet,4.7,26,-6.2242003,106.8525338,"jl. kh abdullah syafei no.2, rt.12/rw.5, bukit duri, kota jakarta selatan",ChIJndinnI_zaS4RsBdPM7-_7mo,1548.7656636952393
indomaret menteng wadas,3,2,-6.2106207,106.8419454,"jl. menteng wadas timur no.17, rt.1/rw.7, ps. manggis, kota jakarta selatan",ChIJVxLzin71aS4R5ngDmYA-lEM,854.8106726704804
indomaret,4.4,75,-6.216285699999999,106.843786,"qrmv+fgp, rt.1/rw.7, menteng atas, south jakarta city",ChIJE27Ce3X0aS4RwPqn75uJU88,466.0366519160591
indomaret menteng wadas 2,3.8,8,-6.2113933,106.8415987,"jl. menteng wadas timur no.11, rt.8/rw.1, ps. manggis, kota jakarta selatan",ChIJt6qq6gz0aS4Rc32yPpqE5bc,762.09383278064
indomaret menara kuningan,5,2,-6.2186328,106.8300399,"6, jl. denpasar no.7, rt.6/rw.7, kuningan, karet kuningan, kota jakarta selatan",ChIJX77vnO3zaS4RglK4CERSUh4,1098.7360517933014
indomaret abdullah syafei 45c,4.7,6,-6.2258963,106.8575556,"jalan kh. abdullah syafei no.45 1 2, rt.4/rw.1, manggarai sel., kota jakarta selatan",ChIJ63NDeWPzaS4RHVCnhEWtXTU,2131.4550568530867
indomaret guntur t 42,4.4,208,-6.2086144,106.8368663,"jl. guntur no.40, rt.8/rw.1, guntur, kota jakarta selatan",ChIJU8fWq6_1aS4RLiY3lLYzs2o,1103.7154588151159
indomaret tebet raya,4.3,37,-6.230342299999999,106.8514366,"jl. tebet raya no.30 a, rt.2/rw.2, tebet bar., kota jakarta selatan",ChIJV7cl6pDzaS4RnpIsEEg4Wik,1864.5844634667176
indomaret stasiun tebet,0,0,-6.227752,106.8563415,"dalam 3, 4, jl. tebet raya no.69, rt.4/rw.1, tebet tim., kota jakarta selatan",ChIJfS5DnODzaS4RByux-xL7Cy4,2107.5308564520956
indomaret al barkah,4.6,18,-6.2204901,106.8472328,"jl. albarkah no.20, rt.7/rw.3, manggarai sel., kota jakarta selatan",ChIJk___P4nzaS4RKHnkXKOuy64,848.2115966727289
indomaret plus,4,88,-6.2212663,106.8270455,"jl. karet pedurenan no.68a, rt.9/rw.4, kuningan, karet kuningan, kota jakarta selatan",ChIJFwAAAPnzaS4RSejras5dRMU,1471.909061517316
indomaret abdullah syafei,3.6,8,-6.2240566,106.8527215,"jl. abdullah syafe'i no.1 bukit duri, tebet, rt.12/rw.1, south manggarai, south jakarta city",ChIJw3pmkY7zaS4RzEJnuWOCvuI,1560.50521062166
indomaret menteng atas,3.8,22,-6.214204,106.8409467,"jl. menteng atas no.rt. 03/06, rt.3/rw.6, menteng atas, kota jakarta selatan",ChIJb2LXKQv0aS4RMsA0_7UBZqw,441.40189774067284
indomaret point,3.3,3,-6.2331067,106.8230684,"patra jasa, jl. gatot subroto, rt.6/rw.3, kuningan, kuningan tim., kota jakarta selatan",ChIJpbNXVUrzaS4Rt_lHfKPzCKM,2507.9818515420257
indomaret itc kuningan,0,0,-6.2235581,106.8259947,"jl. prof. dr. satrio no.18, rt.11/rw.4, kuningan, karet kuningan, kota jakarta selatan",ChIJDW3h1JDzaS4R8CQ1sNCxq94,1660.981006422493
indomaret,4.4,56,-6.2113771,106.8413589,"jl. menteng wadas timur no.3, rw.7, ps. manggis, kota jakarta selatan",ChIJ8wnNTnP0aS4Rt4yRAq93XYE,758.0039807646579
indomaret minangkabau dalam,4.2,195,-6.215694699999999,106.8422542,"jl. minangkabau dalam no.1, rt.4/rw.14, menteng atas, kota jakarta selatan",ChIJt9agVXX0aS4RMX9VQephLU0,364.4727426170181
indomaret apartemen casablanca,1,1,-6.2232986,106.8453453,"jl. raya casablanca no.14, rw.5, menteng dalam, kota jakarta selatan",ChIJV4P3VhjzaS4RnuDMhqW9W2w,833.3899995257195
indomaret - manggarai tb98,3.9,17,-6.2093992,106.8477239,"jl. dr. saharjo no.11d, rt.2/rw.5, manggarai, kota jakarta selatan",ChIJC_j2enH0aS4RLYqRmKfTNwU,1289.0576962551393
indomaret plus,0,0,-6.208247399999999,106.8327765,"qrrm+p42, rt.8/rw.2, guntur, south jakarta city",ChIJZU13Dof1aS4RXIGm2TLCTWY,1348.8262804837632
indomaret wisma staco,5,2,-6.2246197,106.8401752,"wisma staco, jl. raya casablanca no.4, rt.4/rw.12, menteng dalam, kota jakarta selatan",ChIJTYdPFlzzaS4R4JoaMHSAiPY,730.7750491211921
indomaret pedurenan,4.4,99,-6.2222333,106.8261754,"jl. pedurenan masjid iii no.50, rt.8/rw.4, kuningan, karet kuningan, kota jakarta selatan",ChIJjyTKfPnzaS4RmgahJeqJgd8,1593.3831548804806
indomaret (tokx),0,0,-6.206626099999999,106.8267823,"jl. setia budi viii no.10, rt.2/rw.3, kuningan, setia budi, kota jakarta selatan",ChIJq1gLE__1aS4RWeHN-mgTXGM,1933.0324499396816
indomaret permata kuningan,3,7,-6.2123971,106.8336757,"jalan kuningan mulia kav. 9c, kel. guntur, kec. setiabudi, rt.6/rw.1, menteng atas, rt.6/rw.1, menteng atas, kota jakarta selatan",ChIJw___Pw70aS4RWR0PfuJ3EbQ,937.1167927729222
indomaret casablanca,3.7,22,-6.2250076,106.8428196,"jalan casablanca, rt. 07 / rw. 11, menteng dalam, tebet, rt.7/rw.11, menteng dalam, kota jakarta selatan",ChIJVaFRO43zaS4R9wZv9oxkGeI,835.5270395484265
indomaret point stasiun manggarai,3.9,21,-6.2091042,106.8495212,"stasiun kereta api manggarai kebon manggis, rt.15/rw.4, manggarai, kota jakarta selatan",ChIJ4zoAOE7yaS4RTmrqJf3bbYg,1451.294643783643
indomaret point wisma budi,3.8,5,-6.2141795,106.831199,"jl. hr rasuna said no.kav c5-6, rt.3/rw.1, 10, karet, kota jakarta selatan",ChIJS4y29Aj0aS4Rhsigp-JY_H4,1060.059144457837
indomaret plus rasamala,4.1,61,-6.2336278,106.8395619,"jl. rasamala raya no.26, rt.7/rw.9, menteng dalam, kota jakarta selatan",ChIJtaqqauvzaS4RnSCep_ghRMM,1732.617810967285
indomaret,4.2,421,-6.229205299999999,106.8474494,"jl. prof supomo no 321 blok bz persil no 19, rt.13/rw.2, tebet barat, rt.13/rw.2, tebet bar., kota jakarta selatan",ChIJxf__P5bzaS4RZ7KfkYohoDc,1491.067704678548
indomaret karbela,4,35,-6.216086199999999,106.8232321,"jl. flamboyan no.1, rt.9/rw.3, kuningan, karet, kota jakarta selatan",ChIJQ7XctwD0aS4RfpVYI5dO7Tk,1862.2363803113453
indomaret tebet timur dalam raya,4.4,11,-6.236383699999999,106.8568272,"jl. tebet timur dalam raya no.29, rt.11/rw.7, tebet tim., kota jakarta selatan",ChIJzddog5jzaS4RM7Gl9dS3Gbs,2762.392199318231
indomaret convenience store point,4,25,-6.2048824,106.8226389,"wisma indosemen lantai gf/annex kav. 70-71, jl. jenderal sudirman, rt.3/rw.3, kuningan, setia budi, kota jakarta selatan",ChIJJ5m3hBz0aS4RBJ9_gwBC4gk,2410.65602458975
indomaret plaza festival,3.4,10,-6.2212209,106.8328964,"qrhm+g56, rt.2/rw.5, karet kuningan, south jakarta city",ChIJMUTCa23zaS4RHTh8p6ntkmM,856.9134271253475
indomaret pal batu 36,4.3,70,-6.2247397,106.8447512,"jl. pal batu raya no.36, rt.13/rw.4, menteng dalam, kota jakarta selatan",ChIJtX8wqY3zaS4RTpmMPQzAFbg,912.8946595597783
indomaret guru mughni,4.1,41,-6.2269641,106.8213717,"jalan guru mughni no. c4, karet semanggi, setiabudi, rt.5/rw.2, karet semanggi, rt.5/rw.2, karet semanggi, kota jakarta selatan",ChIJ4T8PLOPzaS4RQDVcYaC-IGg,2281.5095844061175
indomaret the peak - tapq,0,0,-6.2105197,106.8242588,"qrqf+rj4, the peak jalan setiabudi raya, rt.2/rw.2, kuningan, setia budi, kota jakarta selatan",ChIJ_1BcKv_1aS4Rlooh3g26uJc,1927.342670543731
indomaret point stasiun mrt dukuh atas,5,1,-6.201634599999999,106.822607,"qrxf+82w, taman dukuh atas jl. jenderal sudirman, rt.10/rw.20, kebon melati, central jakarta city",ChIJ_ZiOif71aS4RT1bOaYGVvB8,2648.1793150267786
indomaret convenience store,4.3,73,-6.2258324,106.858882,"jl. bukit duri tanjakan no. 1 rt 12/ rw 02 rt.3, rt.1/rw.9, bukit duri, kota jakarta selatan",ChIJy6qqaoTzaS4RC_J-x2TbxZU,2263.302182829416
indomaret dr satrio 289,4.6,13,-6.2177327,106.8196168,"jalan professor doktor satrio no.289, karet kuningan, setiabudi rt.1/rw.1, kuningan, rt.1/rw.1, kuningan, karet kuningan, south jakarta city",ChIJf1IrAD3zaS4RP2uQZVJc8jY,2249.2893658252697
indomaret asembaris 2. tc71,3.8,10,-6.2292648,106.8590207,"jalan asem baris, rt.5/rw.5, kebon baru, tebet, rt.5/rw.5, kb. baru, kota jakarta selatan",ChIJ95g2h5vzaS4R0qUPfUiXjys,2448.0622422338756
indomaret casablanca mansion fl12,4,4,-6.223185200000001,106.8461687,"qrgw+qf6, apartemen casablanca mansion jalan casablanca setia budi, rt.14/rw.5, menteng dalam, kota jakarta selatan",ChIJuRjcO4zzaS4RUa5WFynptng,892.5171139025609
indomaret menara imperium (t7xu),4.6,15,-6.2101278,106.8312488,"menara imperium, jl. h. r. rasuna said no.1, rt.1/rw.6, guntur, kota jakarta selatan",ChIJHYztEg_0aS4RoD35swJ40H4,1305.3666475794216
indomaret bukit duri tanjakan 106,0,0,-6.224636500000001,106.8590463,"3, jl. ismail no.13-18, rt.3/rw.9, bukit duri, kota jakarta selatan",ChIJ18ZbnBjzaS4RX9R3AMc2iP0,2233.0270065756185
indomaret,4,7,-6.223765999999999,106.826793,"jl. prof. dr. satrio no.63, rt.11/rw.4, kuningan, karet kuningan, kota jakarta selatan",ChIJq-xEWLDzaS4RO4DqvG3IFd0,1588.3938449612813
indomaret bek murad fz7m,4.2,36,-6.216343999999999,106.8201923,"jl. bek murad no.36, rw.1, kuningan, karet kuningan, kota jakarta selatan",ChIJCzDmJsD1aS4RcZY18yQacU8,2193.625616277767
